Comment,Translated_Comment,Category,Hate Speech,Geography
новини акція «вставай україно » в полтаві виявила нову хворобу влади червень місяць будуть події настільки неуправляємі шоможливо вони в десятки разів будуть жахливіші ніж слвна помаранчева революція проти засранців які фальсифікували вибори буде вперше на україні пролита кров рукигетькорупція квітня рукигетькорупція грудня відповісти це мий коментар архив сайту інтернетвидання полтавщина ,"news, the action ""Stand Up Ukraine"" in Poltava has revealed a new disease of the government, the month of June will be events so uncontrollable that they will probably be ten times more terrible than the famous Orange Revolution against the bastards who falsified the elections, blood will be shed for the first time in Ukraine hands get corruption April hands get corruption December reply this is my comment site archive online publication Poltava region",None,1,Russia_Ukaraine
патриоты блять ебать пипл хуйню хавает ,patriots,None,1,Russia_Ukaraine
чмошникам стойло ,chmoshnikam stoilo,None,1,Russia_Ukaraine
сам ты не из моего рода не мне не пристало заниматься тем о чем ты меня обвиняешь иначе я была бы в земле ты сучий сын не знавший кто твой отец мои мать и отец со мною рядом и давно как и подобает в браке по сравнению с тобой не законнорожденным отребьем ш это профессия ваших наташ работающих в турции в египте и по всему миру и порождающих внебрачных лжецов сволочей мямлящим что то себе под нос ,"you yourself are not from my family, it’s not appropriate for me to do what you accuse me of, otherwise I would be in the earth you are a son of a bitch who didn’t know who your father is, my mother and father are next to me and for a long time, as befits in marriage, compared to you, not legitimate scum is the profession of your natashas working in Turkey in Egypt and around the world and giving birth to illegitimate liars bastards mumbling something under their breath",None,1,Russia_Ukaraine
берут на понт руководство вуза этого никогда не сделает иначе им снизят квоту на следующий год и они останутся без работы напугали ежа голой жопой не ведитесь короче ,"take on a show off the management of the university will never do this, otherwise they will reduce the quota for the next year and they will be left without work scared the hedgehog with their bare ass don’t be fooled in short",None,1,Russia_Ukaraine
оце бичарська морда у цього недоумка ,this moron has a stupid face,None,1,Russia_Ukaraine
чуєш ти виродок ти якщо не знаєш хто стріляє то не п ди ,"do you hear, you bastard, if you don't know who is shooting, then don't shoot",None,1,Russia_Ukaraine
ну что какамада доп сдилась тварь запомните тварь эту чем все закончилось чего то заткнулась она сегодня спросить нужно с нее сейчас за базар пусть ответит ,"Well, what a kakamada, the creature has gone astray, remember this creature, how it all ended, something shut up, she needs to ask today, you need to ask her now for the bazaar, let her answer",None,1,Russia_Ukaraine
автор поста ебать ты имбицыл какой народ сборище боевиков бомжей и алкашей безработных да хрен на них положила уже практически вся страна и если этот бомжовник завтра перехуячут то большинство народа будет рады и только вздохнет от облегчения слава вв и беркуту ,"the author of the post fuck you imbitzil what kind of people are a bunch of militants, homeless and drunks unemployed, and almost the whole country has put hell on them, and if this homeless guy is fucked up tomorrow, then most people will be happy and only sigh with relief, glory to the centuries and the golden eagle",None,1,Russia_Ukaraine
ты историк сраный живи сегодня и не копайся там не где ты не был и ни хрена не знаешь до уровня кончаловского тебе нужно еще раз родиться и не факт что ты этого уровня достигнешь ,"you are a fucking historian, live today and don’t dig where you haven’t been and don’t know a damn thing to the level of Konchalovsky you need to be born again and it’s not a fact that you will reach this level",None,1,Russia_Ukaraine
ну вот денис нестеренко так же банален в своей майнанутости признавайся пил чай на майдауне ,"well, Denis Nesterenko is just as banal in his mindlessness, admit he drank tea on Maydaun",None,1,Russia_Ukaraine
 мики маклай о еще одно выползло ватоцефал нахера тебе наши пенсии ты о своих думай пуйло армянам оружие за ваши пенсии предоставит что бы с азербайджаном было чем воевать а ты камлай дальше уже много раз говорил москалоте еще раз повторю посмотрим объяснять вам неандертальцам бесполезно спорить с вами бесполезно хромосомина лишняя мозги затянула так что по назначению их использовать вам некогда вам с колен вставать нужно вот и посмотрим кто до чего доскачется и кто до чего давстается жизнь покажет ,"mickey maklai oh one more vatocephalus crawled out fuck you our pensions you think about yours puilo Armenians will provide weapons for your pensions so that there would be something to fight with azerbaijan and you kamlai have already told the moscalote many times again I will repeat again let's see explaining to you neanderthals is useless arguing with you is useless extra chromosome tightened brains so that you don’t have time to use them for their intended purpose, you need to get up off your knees, so we’ll see who gets to what and who gets to what life will show",None,1,Russia_Ukaraine
почитав комментарии тут точно попал в адрес вопрос к этим хахланутым ну чего вступили в ес как избавились от олигархов во власти получили кредиты на жизнь а не на армию чего достигли в жизни то ну посрались с россией и дальше что чего делать будете сосать у всех еще в африке угля закажите ой ой подождите так там вас послали уже дальше что что ваша параша и яйценюк сделают дальше опять к нам приползут а хде ваш хличко срите и дальше себе на головы мы тут посмеемся ,"after reading the comments here, the question to these hahlanuty ones was definitely addressed, why did you join the EU how did you get rid of the oligarchs in power received loans for life and not for the army what did you achieve in life, well, you had a fight with Russia and then what to do you will suck from everyone else in order coal in Africa oh oh wait so they sent you there already further that what your bucket and yaytsenyuk will do next they will crawl back to us and where your shit is shit and then we’ll laugh on our heads",None,1,Russia_Ukaraine
 александр криль александр никто бандерлогов наказывать за службу не будет просто потом когда они больше не нужны будут перекроют им финансирование из за океана и все ,"alexander krill alexander no one will punish banderlogs for their service, just later, when they are no longer needed, they will cut off their funding from overseas and that’s all",None,1,Russia_Ukaraine
типичный фсбшный выродок жует жует но суть одна вернуть под русскую диктатуру исконно русские земли стран снг и пр украину и казахстан в первую очередь ,"a typical FSB geek chews chews, but the essence is one to return the primordially Russian lands of the CIS countries, etc., Ukraine and Kazakhstan, under the Russian dictatorship, in the first place",None,1,Russia_Ukaraine
бля а я ведь почти поверил ,damn i almost believed it,None,1,Russia_Ukaraine
каждому евромайдановцу так ребят жалко из беркута ребята держитесь не жалейте патроны мочите быдло ,so sorry for the guys from the golden eagle guys hold on do not spare the cartridges wet the cattle,None,1,Russia_Ukaraine
мусора твари поганные ,trash creatures filthy,None,1,Russia_Ukaraine
еще как заживут а вы в своей рашке захлебнетесь желчью от зависти сиди тихо там ,"how they will heal, and you will choke on bile from envy in your rashka, sit quietly there",None,1,Russia_Ukaraine
судя по тому сколько набежало кацапоидных свинособак фильм годный свиньи срут в нете от безысходности и бедности где им еще заработать ,judging by how many katsapoid pig-dogs ran in,None,1,Russia_Ukaraine
детей жалко какое воспитание они получат от майданутых родителей спаси бог украину ,"I feel sorry for the children what kind of upbringing they will receive from Maidan parents, God save Ukraine",None,1,Russia_Ukaraine
очень хочется чтоб эти якобы офицеры мать ихнюю снайпера внимательно смотрели и сука твари ждали час расплаты а он будет ,"I really want these alleged officers to carefully watch their mother of a sniper and the bitch creatures wait for the hour of reckoning, and he will",None,1,Russia_Ukaraine
в штаны мочить себе будешь вместе с павликом ,you will wet your pants with a pavlik,None,1,Russia_Ukaraine
ну ты еще один идиот блд да кто вас рожает как вы так быстро размножаетесь ,"well, you're another idiot bld yes who gives birth to you how do you multiply so quickly",None,1,Russia_Ukaraine
почему федоров такой идиот а может потому что ему платит цру чтобы он создавал повод для войны и окончательного порабощения россии америкой ой а ведь так и есть гандон а не депутат ,"why is Fedorov such an idiot, or maybe because the CIA pays him to create a pretext for war and the final enslavement of Russia by America oh, but that’s the condom and not the deputy",None,1,Russia_Ukaraine
антимайдан продажные шкуры ,anti-maidan selling skins,None,1,Russia_Ukaraine
 захар захаров и чего эти пидорасы добились ,zakhar zakharov and what did these faggots achieve,None,1,Russia_Ukaraine
быдло с оружием народ ок ,redneck with weapons people ok,None,1,Russia_Ukaraine
а что в россии нет фашистов побольше просто им высунуться не дают русские тоже не навидят не русских одно то что во время матча анжи с иностранной командой стадион болел за тех играли в россии только по тому что анжи кавказская команда этого примера нам хватило чтоб понять что русаки фашисты не надо грешить на укра себя почистите сначало ,"and that in Russia there are no more fascists, they just don’t let them lean out, the Russians also don’t see non-Russians, the only thing is that during the match between Anzhi and a foreign team, the stadium supported those who played in Russia only because Anzhi was a Caucasian team, this example was enough for us to understand that Russians fascists do not have to sin on theft, clean yourself first",None,1,Russia_Ukaraine
донецк красавцы браво так их петухов позорных ,Donetsk beauties bravo so their cocks are shameful,None,1,Russia_Ukaraine
что а что тогда радоваться ну ок хуле ,what and what then rejoice well ok blasphemy,None,1,Russia_Ukaraine
хакамада х ло лалала ,hakamada x lo lalala,None,1,Russia_Ukaraine
да чего им объяснять если они верят что россия сама крым забрала а не то что жители крыма сами проголосовали за то чтобы отделиться от украины и быть с россией если они считают что на донбассе террористы а не те люди которые не хотят гнить под киевской поросенской властью они считают нормальным бомбить города и убивать мирных людей и спихивать всю вину на ополчение и на русских ну конечно во всем всегда виноваты русские путин отправил гуманитарную помощь продовольствие и питание жителям донбасса нет бл ть там танки с солдатам в белых камазах везут это же так цинично со стороны москалей просто пздц убил бы нах й яйценюха американского х есоса блин столько лет бок о бок жили и все было хорошо пришла педаристическая америка с ее европой и пытается наши народы поссорить чтобы уничтожить и россию и украину и во всем виновата гребанная сша когда не будет ее тогда будет мир и спокойствие на нашей планете ,"but why explain to them if they believe that Russia itself took Crimea and not that the inhabitants of Crimea themselves voted to separate from Ukraine and be with Russia if they believe that there are terrorists in the Donbass and not those people who do not want to rot under the Kiev pig government, they they consider it normal to bomb cities and kill civilians and push all the blame onto the militia and the Russians, of course, the Russians are always to blame for everything Putin sent humanitarian aid food and nutrition to the residents of Donbass Muscovites would just fucking kill nah yaytsenyukh American x esos damn it for so many years they lived side by side and everything was fine pedaristic America came with its Europe and is trying to quarrel our peoples in order to destroy both Russia and Ukraine and the fucking United States is to blame for everything when it doesn’t exist then there will be peace and tranquility on our planet",None,1,Russia_Ukaraine
луди жителі донецька у нас одна ціль очистити владу від бандитів ви повинні бути перші тільки тому що в ваших регіонах на виборах більшість голосів ви віддали цим бандитам спочатку зробили пахана президентом а потім привели до влади його братву виправіть цю помилку ,"crazy residents of Donetsk, we have one goal to clean the government from bandits, you should be the first only because in your regions in the elections you gave the majority of votes to these bandits, first you made Pakhan the president and then brought his brother to power, correct this mistake",None,1,Russia_Ukaraine
 евгений мельничук олимиада хуйня ,Yevgeny Melnychuk Olymiada is bullshit,None,1,Russia_Ukaraine
смотрите смотрите это те кто кричит слава беркуту смотрите и пересматривайте это видео те кто голосовал и до сих пор поддерживает покращення пусть такая же судьба настигнет и вас скоты не благодарные рабы защищающие своих господ только они погибли за идею а вы погибните как собаки трусливые слава украине ,watch watch this those who shout glory to the golden eagle watch and watch this video those who voted and still support the reduction let the same fate overtake you and you are cattle not grateful slaves defending their masters only they died for the idea and you die like cowardly dogs glory to ukraine,None,1,Russia_Ukaraine
это твари гребаные наемники по таким уродам нужно открыывать огонь на поражение ,these creatures are fucking mercenaries for such freaks you need to open fire to kill,None,1,Russia_Ukaraine
мы гордимся своей нацией и патриотизмом и свободной украиной вас это не ебет хотим майдан делаем хотим антимайдан наше дело наше право мы боримся за нашу свободу наша земля наши правила ,we are proud of our nation and patriotism and free ukraine it doesn’t give a fuck we want Maidan we do want anti-Maidan our cause is our right we are fighting for our freedom our land our rules,None,1,Russia_Ukaraine
вот пускай получают педики ебаные пули в лоб сука ,so let the queers get fucking bullets in the forehead bitch,None,1,Russia_Ukaraine
сгинь ущербный ,perish the flawed,None,1,Russia_Ukaraine
бугога латвия на порядок лучше рашки в жопе теперь сам тесачок точнее в его очке будут ковыряться в ближайшие несколько лет ,boogoga latvia is an order of magnitude better rashki in the ass now the cleaver itself will be tinkering more precisely in his point in the next few years,None,1,Russia_Ukaraine
какая мразь не дай бог придут к власти в россии опять реки крови потеря курил мы и так теряем наших братьев на украине каждый день каждый час заявляю официально хакамада враг снг кто ее поддерживает враг эта гадость не умеющая одеваца откровенная дура и демогог ,"what kind of scum, God forbid, come to power in russia again, rivers of blood, the loss of smoking, we are already losing our brothers in ukraine every day, every hour, I officially declare the khakamada, the enemy of the cis, who supports the enemy, this muck, who does not know how to dress, an outright fool and demogog",None,1,Russia_Ukaraine
да я из украины нехочу матерится но путин хуйло ла ла ла ,"Yes, I don’t want to swear from Ukraine, but Putin is a dick la la la",None,1,Russia_Ukaraine
это беркут мягенько прошелся надо было было чистить так как пиночет в чили окружить и на поражение чтобы ни один не ушел другим в других странах будет наука что не пытаются валить власть только там где некому пытаться а это достигается разными путями вплоть до метода полной санитарной зачистки революционер майданщик и прочая шушара это уже по сути своей уголовные преступники на уровне государственной измены и наказание должно быть одно смерть любым способом беркут выполнял свой долг но мягко моя бы воля там и танки бы катались по мясу ,"it was the golden eagle that walked softly, it was necessary to clean it, since pinochet should be surrounded in Chile and to defeat so that not one leaves the other in other countries there will be a science that they don’t try to bring down power only where there is no one to try, and this is achieved in different ways up to the method of complete sanitary cleaning revolutionary maidan and other shushara are already essentially criminals at the level of high treason and the punishment should be one death in any way the golden eagle did his duty, but gently my will would be there and the tanks would roll over the meat",None,1,Russia_Ukaraine
 надя правдина ласнешь тунца ,nadya pravdina caress the tuna,None,1,Russia_Ukaraine
 денис коробов слушай острорылый помнится в ельцин не побоялся ввести войска и отстоял власть для своей шайки хотя тогда до гражданской было не далеко чего кстати побоялось сделать гкчп при развале ссср кидать будут все уже кидают коктейли в вв все кому не лень а уничтожь самые активные первые ряды и все остальные сразу на жопу сядут но у януковича духу не хватает так поступить ,"denis korobov, listen, sharp-nosed, I remember Yeltsin was not afraid to send troops and defended power for his gang, although then it was not far from the civilian one, by the way, they were afraid to make the state emergency committee when the ussr collapsed, everyone will already throw cocktails at the cc all and sundry, but destroy the most active first ranks and everyone else will immediately sit on their ass, but Yanukovych does not have the spirit to do so",None,1,Russia_Ukaraine
 это не народ украины кучка диких бандерлог на востоке и юге им дали просраться ,this is not the people of ukraine a bunch of wild banderlog in the east and south they were allowed to shit,None,1,Russia_Ukaraine
вот только путина шестерку либерастную не надо со сталиным сравнивать ок статистику кончаловский привел верную и правду людям неплохо бы знать а лучше бы знать что именно из за либерастии хапитализма у нас все это дерьмо и происходит у нас есть только одна дорога выбраться из этой выгребной либерасткой ямы это социализм ,"it’s just that you don’t need to compare Putin’s liberal six with Stalin, ok, Konchalovsky’s statistics cited true and true people would be nice to know, but it would be better to know that it is precisely because of the liberalism of capitalism that we have all this shit and it’s happening, we have only one way to get out of this liberal cesspool this is socialism",None,1,Russia_Ukaraine
