Comment,Translated_Comment,Category,Hate Speech,Geography
вы рабы по жизни у вас нет чести и достоинства гражданина поэтому закрой рот и молчи ,"you are slaves in life you do not have the honor and dignity of a citizen, so shut your mouth and be silent",None,0,Russia_Ukaraine
 спрытны касінер баксы вже по тро ло ло мавпа не здатна усвідомити свою долю як наслідок й передбачити своє майбутьне я здатен пробачити їм такий вчинок а що поробиш вічна пам ять загиблим ,clever cashier bucks already after troll lol monkey is not able to realize his fate as a consequence and predict his future I am able to forgive them for such an act and what will you do with the eternal memory of the dead,None,0,Russia_Ukaraine
т е ты хочешь сказать что беркут снял это видео не в ночь числа и не на майдане а потом выложил в интернете якобы это события той ночи открой беньки тебе наеуют твои вожди ,"i.e. you want to say that the golden eagle did not shoot this video on the night of the date and not on the Maidan and then posted it on the Internet, allegedly these are the events of that night, open your leaders",None,0,Russia_Ukaraine
єс ,food,None,0,Russia_Ukaraine
мне интересно почему одна часть украины решает как жить другой им кто дал такое право гитлер кто знает просветите ,I'm wondering why one part of Ukraine decides how to live the other who gave them such a right hitler who knows enlighten,None,0,Russia_Ukaraine
за уши притянуто и вырвано из контекста года ,far-fetched and taken out of context of the year,None,0,Russia_Ukaraine
наталия вы глупы половина украинцев говорит на русском но при этом русскими не становятся ,natalia you are stupid half of ukrainians speak russian but don't become russian,None,0,Russia_Ukaraine
вечная память вам ребята ,eternal memory to you guys,None,0,Russia_Ukaraine
не знаю я не медик слушай а может у тебя просто кожа слишком толстая теперь потому и не греют горчичники а в детстве понежнее была вот и чувствовал тогда а украинцы не при чём ,"I don’t know, I’m not a doctor, listen, or maybe your skin is just too thick now that’s why mustard plasters don’t warm, and in childhood it was softer, so I felt it then, and the Ukrainians had nothing to do with it",None,0,Russia_Ukaraine
во время разгона не один добропорядочный труженик не пострадал ,"during acceleration, not one respectable worker was injured",None,0,Russia_Ukaraine
молитва поможет если народ ее услышит иначе никак ,prayer will help if the people hear it otherwise nothing,None,0,Russia_Ukaraine
майданутые одним словом банда отморозков на видео не беркут у тех камуфляж синий а это бендеровцы в форме вв ,"Maidan in one word, a gang of scumbags on the video don’t berkut those blue camouflage, but these are Bendera in the form of VV",None,0,Russia_Ukaraine
начало конца ,Beginning of the End,None,0,Russia_Ukaraine
вже днів пройшло з моменту трагічних подій а висновки не були зроблені здається ми почали забувати за що стояли тоді ,"days have passed since the tragic events and the conclusions have not been drawn, it seems we have begun to forget what we stood for then",None,0,Russia_Ukaraine
давай сша реагируй по полной сколько можно сопли жевать ,let us react to the fullest how much snot you can chew,None,0,Russia_Ukaraine
мне за свою грамоту не стыдно согласен что не готовы в украине еще к свободе а то не рабы быстро превращаются в анархистов не хватает политической грамотности гражданской ответственности за будущее ,"I’m not ashamed of my diploma and I agree that Ukraine is not yet ready for freedom, otherwise it’s not slaves that quickly turn into anarchists; there is not enough political literacy of civic responsibility for the future",None,0,Russia_Ukaraine
украинцы братишки здоровья вам ваш москаль ,Ukrainians brothers health to you your Muscovite,None,0,Russia_Ukaraine
фу не смог досмотреть даже ,wow i couldn't even watch it,None,0,Russia_Ukaraine
хакамада сватит пить с ельциным и так пол страны пропили ,khakamada swat to drink with Yeltsin and so they drank half the country,None,0,Russia_Ukaraine
какой то слабенький разгон препровождают беркут сильно не дубасит не по европейски как то слабенько в париже полиция с несогласными устроила просто кровавую баню короче не сдала украина экзамен на европейские ценности ,"some kind of weak dispersal they escort the golden eagle does not strongly bludgeon not in a European way, somehow weakly in Paris, the police with dissenters just arranged a bloodbath, in short, Ukraine did not pass the exam for European values",None,0,Russia_Ukaraine
враги повсюду европе медленно приходит конец как можно им продаться с потрохами а если хохлы вышли не за европу а за смену власти то тоже ебнулись ,"enemies everywhere Europe is slowly coming to an end how can they sell themselves with giblets and if crests did not go for Europe but for a change of power, then they also fucked",None,0,Russia_Ukaraine
не тянет крашенинникова на исследователя как она заявляет она похожа скорее на демагога который сам напуган и пугает других а если говорить об истории то имперская история московии сплошь построена на подкупе предательстве и шантаже начиная с полковников носа и галагана и сегодня предатель собственного народа янукович партнёр московского президента не понять россиянам демократических стремлений народа поскольку этой самой демократией у них никогда не пахло и ещё не скоро запахнет не понять им простой истины что рядовые граждане любой страны в сумме богаче правительства банков и корпораций вместе взятых что и подтверждает реальная революция в украине никто не оплачивает майдан люди просто помогают друг другу чем могут как только турция подписала такой же договор с евросоюзом как должен был подписать янукович там начались аресты высокопоставленных чиновников и их родственников связанных с коррупцией беркут спецподразделение созданное исключительно для борьбы с вооруженными террористами применило всё своё умение против безоружных студентов ,"does not draw Krasheninnikov to a researcher, as she claims, she looks more like a demagogue who is frightened and frightens others, and if we talk about history, then the imperial history of Muscovy is entirely built on bribery, betrayal and blackmail, starting with the colonels of the nose and galagan and today Yanukovych, a traitor to his own people, is a partner of the Moscow president Russians do not understand the democratic aspirations of the people, since they have never smelled of this very democracy and will not smell soon; people just help each other in any way they can as soon as Turkey signed the same agreement with the European Union as Yanukovych was supposed to sign, there began arrests of high-ranking officials and their relatives associated with corruption golden eagle special forces created exclusively to fight armed terrorists used all their skills against unarmed students",None,0,Russia_Ukaraine
интересно эти новости им сам порошенко пишет а почему не показали подрезанных беркутовцев или для канала они не граждане мерзкий канал как и его хозяева ,"it’s interesting that Poroshenko himself writes this news to them, why didn’t they show the cut Berkut soldiers or for the channel they are not citizens of a vile channel like its owners",None,0,Russia_Ukaraine
клоун ,clown,None,0,Russia_Ukaraine
чтоб такого не было надо просто запретить финансировать сми и политические партии иностранными гражданами и физ лицами ,"so that this does not happen, it is simply necessary to prohibit the financing of the media and political parties by foreign citizens and individuals",None,0,Russia_Ukaraine
хакамада кошка которая гуляет сама по себе никогда она народным рупором не была да и предателем не пришлось просто всегда держит нос по ветру и как будто в теме но не при делах ,"khakamada is a cat that walks by itself, it has never been a popular mouthpiece, and it didn’t have to be a traitor, it just always keeps its nose to the wind and seems to be in the subject but not in business",None,0,Russia_Ukaraine
приезжие гастрабайтеры город загаживают а киевляне страдают разбивали бы в своих галициях палатки так нет надо в киев ехать достали ,"visiting gastrabeiters pollute the city, and the people of Kiev suffer, they would pitch tents in their Galicia, so no, they got to go to Kyiv",None,0,Russia_Ukaraine
голимый бандитизм сколько у него забрали денег ,naked banditry how much money was taken from him,None,0,Russia_Ukaraine
крим належить україні уникайте новому срср ,"Crimea belongs to Ukraine, avoid the new USSR",None,0,Russia_Ukaraine
 павел переверзев когда я пишу на эмоциях делаю иногда граммотические ошибки я думаю доценту кафедры органической химии это позволительно ,"pavel pereverzev when I write on emotions I sometimes make grammatical errors, I think the assistant professor of the department of organic chemistry is allowed",None,0,Russia_Ukaraine
народ чё вы срётесь тут причём тут простые гражданские это всё политики виноваты и причём тут обыкновенные люди которые себе мирно живут вините политиков а не нас простых людей это относится ко всем ,"people, why are you shitting here, and here ordinary civilians are all politicians to blame, and where does ordinary people who live peacefully blame politicians and not us ordinary people, this applies to everyone",None,0,Russia_Ukaraine
здохни янукович ти того заслужив ,"die, Yanukovych, you deserved it",None,0,Russia_Ukaraine
 побитый сам вызывает себе скорую чё то кровь на лбу краску напоминает бодренько так пробитой головой крутит ,"the beaten man calls himself an ambulance, something like blood on his forehead, the paint reminds him cheerfully, so he twists his broken head",None,0,Russia_Ukaraine
давно пора мочить бендер ,it's time to wet the bender,None,0,Russia_Ukaraine
валентина шваб а по чему ,valentina schwab why,None,0,Russia_Ukaraine
после майдана я сделал уровень жизни украинского народа значительно ниже чем элыдень янукович слава мне благодарю обаму и меркель а украинским нацдурням которые меня поддержали ганьба ,"after the Maidan, I made the standard of living of the Ukrainian people much lower than Yanukovych’s day, thank me thank Obama and Merkel, and the Ukrainian national fools who supported me are a shame",None,0,Russia_Ukaraine
совсем недавно услышал эту песню которая в очередной раз показывает близость наших народов очень красивая понятная и близкая всем славянам ,"just recently I heard this song, which once again shows the closeness of our peoples, very beautiful, understandable and close to all Slavs",None,0,Russia_Ukaraine
я бажаю вам успіху зі словаччини ,I wish you success in Slovakia,None,0,Russia_Ukaraine
признали свою независимость и теперь не хотя ее потерять правильно вперед хохлы на запад там свобода демократия права человека и тд ,"recognized their independence and now they don’t want to lose it right forward crests to the west there is freedom, democracy, human rights, etc.",None,0,Russia_Ukaraine
почему молодцы потому что на рожон лезут люди прекратите панику и драки время покупать новогодние подарки и подписывать открытки давайте решать проблему мирным путём ,why well done because people are on the rampage stop panicking and fighting time to buy new year gifts and sign postcards let's solve the problem peacefully,None,0,Russia_Ukaraine
молодец ирина очень симпатична мне она как политик жаль что она иногда бывает не сдержана или наоборот где бы надо поставить собеседника на место молчит ей бы лет с плеч долой пошла бы за ней под некоторыми высказываниями подписываюсь ,well done Irina is very pretty to me as a politician it is a pity that she is sometimes not restrained or vice versa wherever it is necessary to put the interlocutor in place she is silent for years off her shoulders would have followed her under some statements I subscribe,None,0,Russia_Ukaraine
молодец ✊ ✊✊✊✊✊✊✊✊✊ ,well done ✊ ✊✊✊✊✊✊✊✊✊,None,0,Russia_Ukaraine
хохлы блеать че вы творите дауны сами себя уничтожаете эта долбаная евроинтеграция не стоит стольких человеческих жизней ,crests bleat what are you doing downs are destroying yourself this fucking European integration is not worth so many human lives,None,0,Russia_Ukaraine
наконец то ,finally,None,0,Russia_Ukaraine
 тисяч десь ,thousands somewhere,None,0,Russia_Ukaraine
вот ради того чтобы такого больше не повторилось люди и вышли на майдан ,"so that this does not happen again, people went to the Maidan",None,0,Russia_Ukaraine
врёт не краснеет ещё ухмыляется ,lying not blushing still grinning,None,0,Russia_Ukaraine
парень на видео несет полную чушь одно из двух он или полностью дезинформирован или у него мания преследования а может быть просто лапшу на уши россиянам вешает по заданию путина ,"the guy in the video is talking complete nonsense one of two things, he is either completely misinformed or he has a persecution mania, or maybe he just hangs noodles on the ears of the Russians on Putin's instructions",None,0,Russia_Ukaraine
порощенко хазяин фирмы рошен сколь ты милиардов с бюджета вытаскал уххх ,poroshchenko the owner of the firm Roshen how many billions did you pull out from the budget uhhh,None,0,Russia_Ukaraine
как раз только что говорили по еспрессо тв что будет куча титушек с желтыми ленточками власти уже им начали оружие выдавать ужас какой ,"they just said on espresso tv that there will be a bunch of titushki with yellow ribbons of power, they have already begun to give out weapons to them, what horror",None,0,Russia_Ukaraine
руслану влепили в ряд жесть эта клоунесса скачет под любой бубен на майдане ,Ruslana was stuck in a row of tin this clown jumps to any tambourine on the Maidan,None,0,Russia_Ukaraine
уже доказано журналістами что это видео было снято в часов вечера накануне в эпизоде где провокатор кидает яйца а сам разгон майдана был в утра так что это видео смонтированая лажа ,"it has already been proven by journalists that this video was filmed at 1 p.m. the day before in the episode where the provocateur throws eggs and the dispersal of the Maidan itself was in the morning, so this video is a crap edited",None,0,Russia_Ukaraine
здоровые силы всегда были и есть в украине к тому же это не югославская ситуация тут рядом стоят россия и беларусь и никакие красивые фразы здесь не нужны нужны реальные шаги ближайшее время всё покажет ведь на западе сейчас ждут когда полыхнет по настоящему в украине чтобы прийти брать своё как они считают прийти за добычей как стервятники и вырвать своё ,"healthy forces have always been and are in Ukraine, besides, this is not a Yugoslav situation, here Russia and Belarus are standing next to each other and no beautiful phrases are needed here, real steps are needed in the near future, everything will be shown because in the West they are now waiting for the real blaze in Ukraine to come take their own how they think to come for prey like vultures and snatch their",None,0,Russia_Ukaraine
с крымом не красиво получилось и очень мутно но опять одно но власть его просто отдала россии и венить одних россиян просто глупо хоть одно чиновника посадили или расстреляли за сдачу крыма нет согласен с вами хочется больше порядка и стабильности но смотрите что же такое были же люди как люди и вдруг все сразу стали кретины парадокс с и как с ними строить страну я когда поступал в на работу в сбу то у меня спросили почему хочу работать у них я ответил что хочу защищать родину так на лицах полканов я увидел усмешку ,"with Crimea, it didn’t turn out beautifully and it’s very muddy, but again, one thing, but the authorities simply gave it to Russia and it’s just stupid to blame some Russians, at least one official was imprisoned or shot for surrendering Crimea, I don’t agree with you, I want more order and stability, but look what it was like people people and suddenly all at once became cretins a paradox with and how to build a country with them, when I went to work in the SBU, they asked me why I wanted to work for them, I answered that I wanted to defend my homeland so on the faces of the polkans I saw a smile",None,0,Russia_Ukaraine
на видео не беркут это экиперовка с разграбленных складов западной украины обратите внимание на обувь оружие вв и буркуту не выдавали не ведитесь на фейк на видео переодетые террористы из правого сектора ,"in the video, the golden eagle is not equipment from the plundered warehouses of western Ukraine; pay attention to the shoes;",None,0,Russia_Ukaraine
так ломятся что не протолкнуться от гастарбайтеров ломились бы уже на самом деле ,so bursting that not to push through from guest workers would have burst in fact,None,0,Russia_Ukaraine
в европе не бьют мирных протестующих а у нас побили беременную женщину беркутовцы не говоря о сотнях с пробитыми головами и сломанными ребрами ни за что ,"in Europe they don’t beat peaceful protesters, but in our country Berkut’s men beat a pregnant woman, not to mention hundreds with pierced heads and broken ribs for no reason",None,0,Russia_Ukaraine
а теперь смотрим как это же самое делается в евросоюзе название в поисковике митинги в германии немецкий опыт полиции смотрим перенимаем опыт в ес так в ес ,and now we are looking at how the same thing is done in the European Union name in the search engine rallies in Germany German experience of the police we are watching adopting experience in the EU so in the EU,None,0,Russia_Ukaraine
 ербол биесов в центра международной журналистики и исследований миа «россия сегодня» она тоже работает в одиночку зачем вы унижаете человека пусть даже вашего врага если он заведомо умнее и успешнее от бессильной злобы и умственной отсталости ,"Erbol Biesov at the Center for International Journalism and Research of MIA “Russia Today” she also works alone, why do you humiliate a person, even your enemy, if he is obviously smarter and more successful from impotent anger and mental retardation",None,0,Russia_Ukaraine
передивився це грудня згадав з чого почалося і що вже встигло статися я зрозумів що я гордий за націю за свій народ за те що сталося за ці діб це кардинально змінило країну показало що люди можуть піднятися і вийти ніяка влада нам не стане не заваді я зразу надіявся що з цього щось буде ще не було й людей не було ,"I rewatched it in December, I remembered how it started and what has already happened, I realized that I am proud of the nation, of my people, for what happened during these days, it radically changed the country, it showed that people can rise up and leave, no power will stop us, I immediately hoped that something would come of it had not yet happened and there were no people",None,0,Russia_Ukaraine
и всё же мне не понятно почему хакамада проиграла она рально умнее той второй курицы ,"and yet I don’t understand why Khakamada lost, she’s actually smarter than that second chicken",None,0,Russia_Ukaraine
 алексей конюшняк стояла американская колонна тоесть власовцы ,alexey konyushnyak was an american column i.e. Vlasov,None,0,Russia_Ukaraine
