Comment,Translated_Comment,Category,Hate Speech,Geography
роман сыроватко страна стремительно деградирует из за таких тупых уродов как ты ,romance dampish the country is rapidly degrading because of such stupid freaks like you,None,1,Russia_Ukaraine
 сеера макс я живу в восточной украине уж здесь самая задница ,"seera max I live in eastern ukraine, the ass is here",None,1,Russia_Ukaraine
 я українець а мне пофиг мне коврик нужен реальность как раз именно логике он и поддается если бы люди руководствовались просто логикой такие тупые ситуации были бы невозможны зачем кому то или чему то служить вообще люди рождаются не для того чтобы служить разве беркутовцы служат развен это не работа они не могут просто уволиться военные понятно они присягали какому то абстрактному государству формально они связаны обязательствами ,"I’m Ukrainian and I don’t care, I need a rug that needs reality, it’s precisely logic that it lends itself to if people were guided simply by logic, such stupid situations would be impossible why serve someone or something at all people are not born to serve, do Berkut officers serve, isn’t this work they can’t just quit the military, it’s clear they swore allegiance to some abstract state, formally they are bound by obligations",None,1,Russia_Ukaraine
правильно делают что мнут бока быдлоте которая вышла за гривень на площадь жалко не применили водомёты ,"they do it right that they crumple the sides of the cattle that went beyond the hryvnia to the square, it’s a pity they didn’t use water cannons",None,1,Russia_Ukaraine
обычно люди пытаются вытереть лицо а эти специально такие ходят чтобы больше эффекта были получили звизды ,"usually people try to wipe their faces, and these people go specially so that they get more effect, they get stars",None,1,Russia_Ukaraine
ахаха так и надо мразям либерастам беркуту зачет ,ahaha and it is necessary for the scum of the liberals to the golden eagle offset,None,1,Russia_Ukaraine
кто то бабла рубит на этом мероприятии сейчас неплохое хули желеть беркут или нет они наемники им платят за это народ реально жалко что достались такие ушлепки у власти хз что будет дальше но дальше уже не будет как раньше ,"someone is cutting the dough at this event now, it’s not a bad thing to jelly the golden eagle or not, they are mercenaries, they are paid for it, the people are really sorry that they got such slickers in power xs what will happen next, but then it won’t be like before",None,1,Russia_Ukaraine
я бы открыл стрельбу по талпе ведь они угражают жизни своими булыжниками и цепями в пендосси уже бы растреляли ,"I would open fire on Talpa, because they threaten lives with their cobblestones and chains in pendossi, they would have already shot",None,1,Russia_Ukaraine
молодцы украинцы приятно видеть то как они боролись за свои права и свободы и били поганых мусоров слава украине ,"Well done Ukrainians, it's nice to see how they fought for their rights and freedoms and beat the filthy garbage glory to Ukraine",None,1,Russia_Ukaraine
клоуны блядь ,clowns fucking,None,1,Russia_Ukaraine
 арина корина обоснуйте своё обвинение с чего вы взяли что я фашист я ведь могу тоже написать что вы трассовая шлюха но если я не обосную то это только голословное обвинение и так с чего вы обвинили меня в фашизме ,"arina korina justify your accusation, where did you get the idea that I'm a fascist, I can also write that you are a highway whore, but if I don't substantiate it, then this is just an unfounded accusation, and so why did you accuse me of fascism",None,1,Russia_Ukaraine
я вот не могу понять если я ненавижу януковича вместе с его комуноуголовную семейку и хочу его сместить значит я фашист значит люди которые грабят страну последние года это молодцы классные ребята а те кто хотят его сместить фашисты почему я не имею право в собственной стране развиваться люди которые вышли на майдан хотят только одного иметь право на самозащиту и на саморазвитие мусорские чиновники при януковиче так охамели что могут любого закрыть в часа и надолго милиция в государстве отсутствует медицина отсутствует судов нет и это по мнению россиян хорошо а попытка изменить свою жизнь к лучшему фашизм че за бред нас достала эта комунофашистская мразь которая паразитирует на людях мы просто хотим жить свободно и быть увереными в завтрашнем дне что в этом плохого ,"I just can’t understand if I hate Yanukovych along with his comuno-criminal family and want to remove him, then I’m a fascist, then people who have been robbing the country in recent years are great guys, and those who want to remove him are fascists, why I don’t have the right to develop people in my own country who they went to the Maidan, they only want to have the right to self-defense and self-development, the Musor officials under Yanukovych were so crazy that they could close anyone in an hour and for a long time. this comuno-fascist scum that parasitizes on people got us for nonsense, we just want to live freely and be sure of tomorrow what's wrong with that",None,1,Russia_Ukaraine
смерть виродкам мусорським до коліна ,death to the knee-deep bastards,None,1,Russia_Ukaraine
гори в аду крым донбасс украина оккупантам жестокая смерть путлер капут ,burn in hell crimea donbass ukraine invaders cruel death putler kaput,None,1,Russia_Ukaraine
так ты двуличный мудак живешь в европе а в украине хочешь видеть зону под паханатом янукевича я не от тебя бабло получаю не волнуйся сибирь пишется через и грн получает титушка баксов беркут баксов тихарь мент ну а снайпер конечно больше и не пори гарячку про снег я тебя умоляю это бред ,so you are a two-faced asshole you live in europe and in ukraine you want to see a zone under the godfather of yanukevich i don’t get loot from you don’t worry that's bullshit,None,1,Russia_Ukaraine
 александр пяткин бандеровцев бить можно и нужно ,Alexander Pyatkin Bandera can and should be beaten,None,1,Russia_Ukaraine
идейные дураки ,ideological fools,None,1,Russia_Ukaraine
передачка во главе пидора сасет у путлера и доволен ,the transfer at the head of the fag sucks at the putler and is satisfied,None,1,Russia_Ukaraine
эти выродки не только о присяге забыли но уже в них ничего человеческого не осталось продались режиму и дьяволу так теперь пусть не удивляются что народ им не только не доверяет но презирает и ненавидит жаль что название беркут как слово нарицательное звучит им больше название из падальщиков подойдет стервятники ,"these geeks not only forgot about the oath, but there was nothing human left in them, they sold themselves to the regime and the devil, so now let them not be surprised that the people not only do not trust them, but despises and hates it is a pity that the name golden eagle as a household word sounds more like a name from scavengers, vultures will do",None,1,Russia_Ukaraine
это не революция а продажные америкосные шестерки ,"this is not a revolution, but corrupt American sixes",None,1,Russia_Ukaraine
зажигательными по етим зверям гасить надо ебаные продажные суки стоят там за гр ,incendiary on these animals it is necessary to extinguish the fucking corrupt bitches are there for gr,None,1,Russia_Ukaraine
параноидальная мания преследования это про этого гаврика и хрень про все видео в целом ,paranoid persecution mania is about this gavrik and crap about the whole video in general,None,1,Russia_Ukaraine
ваня рус сволочь молись мразь гореть тебе в аду тварь москальская я плюю на тебя и на могилы твоих предков и на твою могилу буду плевать ,vanya rus bastard pray scum burn in hell for you moskal creature I spit on you and on the graves of your ancestors and I will spit on your grave,None,1,Russia_Ukaraine
они только скакать жрать срать спать могут и им этого вполне хватает для счастья ,"they can only jump, eat, shit, sleep, and this is quite enough for them to be happy",None,1,Russia_Ukaraine
мудак монголский у тебя печалка твои братья чурки колорады не сняли в одессе свое самосожжение поэтому никаких кадров и нет ,mongolian asshole you have sadness your brothers chocks of colorado did not film their self-immolation in odessa therefore there are no shots,None,1,Russia_Ukaraine
пиздаболия вру ,pizdaboliya lie,None,1,Russia_Ukaraine
за что стояле сука за новую полицию которая лишь прибавила понтов за цены космические за безвиз который нахер никому не нужен а проще уже визу сделать а за зарплаты в тысячу гривен а сука я за украину и сам я уроп да что толку то нихуя не изменилось ,"for which the bitch stood for the new police, which only added show-off for cosmic prices for visa-free travel, which the fuck no one needs, but it’s easier to get a visa, and for salaries of a thousand hryvnias, and the bitch I’m for Ukraine and I myself am urop, but what’s the point, the fucking hasn’t changed",None,1,Russia_Ukaraine
этих беркутовских ублюдков ждет трибунал и зона как и их вора януковича а путин с лукашенко пусть ждут они следующие ,"these Berkut bastards are waiting for a tribunal and a zone like their thief Yanukovych, and let Putin and Lukashenka wait for the next",None,1,Russia_Ukaraine
 афанасий крутиков ну за гроши с обеих сторон шакалов хватает и насколько я вижу информацию активно искажают с обеих сторон причем обильно посыпают своим мнением хотя нет вряд ли своим а у тебя я вижу мнение о востоке страны уже сложилось и не похоже что ты готов слушать чье то мнение зомби же не люди а значит с ними можно не считаться да и убить не жалко прямо милосердие ,"afanasy krutikov, well, there are enough jackals for pennies on both sides, and as far as I see the information is actively distorted on both sides, moreover, they are abundantly sprinkled with their opinions, although it’s hardly yours, but I see you already have an opinion about the east of the country and it doesn’t look like you are ready to listen to someone the opinion of zombies is not people, which means they can be ignored and it’s not a pity to kill directly mercy",None,1,Russia_Ukaraine
а я думаю вместо беркута сталинских пулеметчиков там надо поставить с приказом зачистить площадь от стада бешеных быдлотников сколько же этого дерьма развелося в нашей стране в европу захотели а что они сделали для этого за что голосуют лутше бы работали как все нормалиные люди на заводах и фабриках экономику подымали бы они думают украина европе нужна да плевать она хотела на украину у них своих проблем хватает самая главная проблема у них унижтожить славян любым способом ес это один из этих способов конечно же эта школота сыкунская живущая за мамины и папины деньги этого не поймет куда уж им там за евро бутеры с евро чам они и мать ролную продадут как это сделали ихнии бабки деды продали советский союз за банку гнилых консервов прежде чем идти в европу нужно жить по европейски научиться а не стоять с голым задом и требовать не понятно что ,"but I think instead of a golden eagle, Stalin’s machine gunners should be put there with an order to clean up the area from a herd of rabid bydlotniks, how much of this shit was divorced in our country to Europe, and what did they do for this, what they vote for, they would better work like all normal people in factories and factories they think Europe needs ukraine, yes, she didn’t care about ukraine, they have enough problems of their own, the main problem they have is to destroy the slavs in any way the eu is one of these methods, of course, this Sykun shkolota living for mother’s and father’s money will not understand where they can there, for euros, they will sell sandwiches with euros, and they will sell their mother like they did, as their grandparents did, they sold the Soviet Union for a can of rotten canned food before going to Europe, you need to learn how to live in Europe and not stand with your bare ass and demand it’s not clear what",None,1,Russia_Ukaraine
у силовиков калаши с другим прикладом а у этих гнид с повязками складные приклады это не силовики а боевики нанятые западом ,"the security forces have Kalash with a different butt, and these nits with bandages have folding butts, these are not security forces, but militants hired by the West",None,1,Russia_Ukaraine
зечара тебя ждет судьба каддафи ,zechara the fate of Gaddafi awaits you,None,1,Russia_Ukaraine
 анна арич иди на хуй мелкими шагами ,anna arich go fuck yourself with small steps,None,1,Russia_Ukaraine
вот зачем нам нужна реформа в правоохранительных органах но всем же пофиг ,"that's why we need law enforcement reform, but nobody cares",None,1,Russia_Ukaraine
даун мабудь куплений пр черговий титушко клавіатурний ,down must have been bought pr the next titushko keyboard,None,1,Russia_Ukaraine
ага европейска нация ох ели что ли ,yeah European nation oh ate something,None,1,Russia_Ukaraine
а где нашивки беркута у снайпера я вижу только мудака позирующего на камеру и стреляющего в людей профи себя так не ведут ,"and where are the sniper’s stripes of a golden eagle, I only see an asshole posing for the camera and shooting at people, the pros don’t behave like that",None,1,Russia_Ukaraine
 мирослав карпюк ахаха эбалка не выросла еще эбака хуев твоя мама хуи сосала чтоб ты за интернет заплатил а ты хуйню всякую пишеш лучше бы что нибудь умное прочитал дефективный ,miroslav karpuk,None,1,Russia_Ukaraine
гандон ,gandon,None,1,Russia_Ukaraine
 уровень жизни показатель столь же бессмысленный сколь и средняя температура по больнице но каклоте не понять к европейской зарплате идут и европейские цены и европейские налоги и европейская безработица так что получается что в россии и даже на украине зарплата внезапно намного больше шкура продажная такая шкура ,"the standard of living is an indicator as meaningless as the average temperature in the hospital, but how can you not understand the European salary and European prices and European taxes and European unemployment, so it turns out that in Russia and even in Ukraine the salary is suddenly much more skin selling such a skin",None,1,Russia_Ukaraine
иди в нато проститутка ,go to nato prostitute,None,1,Russia_Ukaraine
а вопрос на засыпку хочешь а как ты думаеш кто такими как вы сегодня правит да да да да наш президент с донецка а ты сучара подстилка польская ,"and you want a question for backfilling, but what do you think, who rules like you today yes yes yes yes our president is from Donetsk and you are a bitch Polish litter",None,1,Russia_Ukaraine
наконецто бандеров крошат ,finally crush Bandera,None,1,Russia_Ukaraine
там же в жопе ,right there in the ass,None,1,Russia_Ukaraine
та как они заебали обосранцы с западной у нет украины засраки такой красивый город киев когда их уже водичкой обольют чтоб суки разбежались уроды ,and how they fucked up the western bastards there is no shit in ukraine such a beautiful city of Kyiv when they are already poured with water so that the bitches run away freaks,None,1,Russia_Ukaraine
вот тебя рожа выдает финно наглая угорская народность европейская мордва ,here's your mug betraying Finno impudent Ugric people European Mordovians,None,1,Russia_Ukaraine
блять переведите мне название ролика с этого уёбищного хохлядского ,fuck translate me the name of the video from this fucking khokhlyadsky,None,1,Russia_Ukaraine
дебилы западные нахуй с майдана хреново что беркут вас не поубивал ,Fuck Western morons from the Maidan sucks that the golden eagle didn't kill you,None,1,Russia_Ukaraine
кацапы згиньте на хуй ,fuck you bastards,None,1,Russia_Ukaraine
 украина свободная страна нормально это при фашистах у власти кто когда и где жил нормально а вам баранам говорили не гоните лошадей не нарушайте конституцию не скачите за баксов заплатить придется гаразда больше вот и ищите теперь врагов и виновных коль с головами не все в порядке херовому танцору яйца всегда мешают так и вам плоскоголовым живущими одним днем путин виноват янукович конечно же козел и мразь но он был законноизбранным чего не скажешь о парашкине и его свите и возвращению януковича здесь ничего не светит по крайней мере на донбассе на него хуй положили еще тогда когда он присмыкнулся перед бандеровцами и сбежал падла со страны ,"ukraine is a free country, it’s normal under the fascists in power who, when and where lived normally, but you were told to sheep don’t drive horses don’t violate the constitution don’t jump for bucks you’ll have to pay a lot more, so now look for enemies and guilty ones if not everything is fine with the heads of the crappy egg dancer they always interfere with you, flat-headed people who live one day, Putin is to blame, of course, Yanukovych is a goat and scum, but he was legally elected, which cannot be said about Parashkin and his retinue and the return of Yanukovych, nothing shines here, at least in the Donbas they put a dick on him even when he joined before Bandera and fled the bastard from the country",None,1,Russia_Ukaraine
россейские толерантые терпилы комментисты против своей власти ссут поднятся так хоть в инете с украинцами повоюют велика россия а отступать не куда позади москвабад бууугага ,Russian tolerant terpily commentators against their power piss rise so even though in the internet they will fight with the Ukrainians great russia and there is nowhere to retreat behind moskvabad buuugaga,None,1,Russia_Ukaraine
вас обманывают идиоты что ли ,you are being lied to by idiots,None,1,Russia_Ukaraine
 игорь ратников слушай мы уже скоро подарки отправим вам бендерам пидорасам после сирии готовте дупы и гробы себе слава россии и слава вв путину ,Igor ratnikov,None,1,Russia_Ukaraine
салоедская серая масса даже не понимают за что митингуют хаха ,saloed gray mass don't even understand why they are protesting haha,None,1,Russia_Ukaraine
кацапы просто в шоке и ахуе не ожидали сучки ,katsaps are just in shock and ahue did not expect bitches,None,1,Russia_Ukaraine
отдавайте восток и крым россие и уёбуйте в европу раз так сильно туда хотите правильно мусара вас пиздят восток украины не стремится на тех условиях что сейчас в европу ,give back the east and the crimea to russia and fuck off to europe if you want to go there so much right mussara they fuck you the east of ukraine does not seek on the conditions that now to europe,None,1,Russia_Ukaraine
майданеры в своем репертуаре как залупаться на рабочих готовивших майдан к новому году так все такие грозные а как обратку получают только и могут кричать ганьба и идти жаловаться что избили бедненьких ,maidaners in their repertoire how to get mad at the workers preparing the maidan for the new year so everyone is so formidable and how they only get the return line and can shout slander and go complain that they beat the poor,None,1,Russia_Ukaraine
это трусливый скот погоды он не сделает ,this cowardly cattle of the weather he won't do,None,1,Russia_Ukaraine
иди бухай и вату в ушах проверь она себе в савке понадобится ,"go drink and check the cotton wool in your ears, you will need it in your shack",None,1,Russia_Ukaraine
